Role,Company Name,Location,Posted Date,Extracted Date,Key Skill,Experience,Job Description,More Detail
Data Analyst - Associate Data Analyst  /  Data Analyst,Information Services Group,Bengaluru / Bangalore,few days ago,2024-02-19,"data analysis   ,   python   ,   excel   ,   data visualization   ,   sql   ,  bi  ,  data extraction  ,  database  ,  git  ,  technical skills  ,  machine learning  ,  infrastructure  ,  data communication",2 - 3 yrs,"Data Analyst - Associate Data Analyst  /  Data Analyst Research-Provider Lens Bangalore ,  IndiaApplyDescriptionWanted: dynamic and creative individuals ready to connect with ...",https://www.timesjobs.com/job-detail/data-analyst-associate-data-analyst-data-analyst-information-services-group-bengaluru-bangalore-2-to-3-yrs-jobid-wpyIiSD9lNZzpSvf__PLUS__uAgZw==&source=srp
Data Analyst - Associate Data Analyst  /  Data Analyst,Information Services Group,Bengaluru / Bangalore,few days ago,2024-02-19,"data analysis   ,   python   ,   excel   ,   data visualization   ,   sql   ,  bi  ,  data extraction  ,  database  ,  git  ,  technical skills  ,  machine learning  ,  infrastructure  ,  data communication",2 - 3 yrs,"Data Analyst - Associate Data Analyst  /  Data Analyst Research-Provider Lens Bangalore ,  IndiaApplyDescriptionWanted: dynamic and creative individuals ready to connect with ...",https://www.timesjobs.com/job-detail/data-analyst-associate-data-analyst-data-analyst-information-services-group-bengaluru-bangalore-2-to-3-yrs-jobid-nCzNuOOzXQFzpSvf__PLUS__uAgZw==&source=srp
Data Analysts,Zoxima Solutions Pvt. Ltd.,,few days ago,2024-02-19,"reports  ,  Data Analysts  ,  MySQL",3 - 8 yrs,"Experience  3-8 YearsJOB INFORMATIONVery good programming skills ,  preferably in R languageStrong Experience in MySQLAbility to grasp nuances of business quicklyExperience in...",https://www.timesjobs.com/job-detail/data-analysts-zoxima-solutions-pvt-ltd-3-to-8-yrs-jobid-ykoXKM9SnchzpSvf__PLUS__uAgZw==&source=srp
Data Analyst,the modern dimension,"Delhi,  Delhi/NCR,  Bengaluru / Bangalore",4 days ago,2024-02-19,"oracle  ,  sas  ,  bi  ,  dashboards  ,  data analyst  ,  alteryx  ,  sql  ,  tableau",3 - 6 yrs,"Responsibilities Building advanced workflows using Alteryx3 years- experience in an analytics related field.3 years- experience using a business intelligence  ( BI )  tool ,  ...",https://www.timesjobs.com/job-detail/data-analyst-the-modern-dimension-delhi-delhi-ncr-bengaluru-bangalore-3-to-6-yrs-jobid-MLY5JvW__PLUS__ks9zpSvf__PLUS__uAgZw==&source=srp
Data Analyst,ADROIT LEARNING AND MANPOWER PVT LTD,Ahmedabad,5 days ago,2024-02-19,"data analysis  ,  dashboards  ,  data analyst  ,  sql  ,  tableau  ,  infrastructure  ,  data visualization",7 - 10 yrs,"You will work on and contribute into building a modern analytics platform leveraging AWS technologies including Glue ,  S3 ,  Athena ,  RedShift ,  and QuickSight. You will de...",https://www.timesjobs.com/job-detail/data-analyst-adroit-learning-and-manpower-pvt-ltd-ahmedabad-7-to-10-yrs-jobid-O6rsbebTEJNzpSvf__PLUS__uAgZw==&source=srp
Data Analyst,HyreFox Consultants,Jaipur,few days ago,2024-02-19,"data analytics  ,  business requirements  ,  bi  ,  dashboards  ,  data analyst  ,  sql  ,  tableau",0 - 3 yrs,MAIN DUTIES AND RESPONSIBILITIES Create business reports and process all data extracts and imports; ensuring accuracy and attention to detail at all times Collate and produce ...,https://www.timesjobs.com/job-detail/data-analyst-hyrefox-consultants-jaipur-0-to-3-yrs-jobid-xI2bjtkBOw5zpSvf__PLUS__uAgZw==&source=srp
Data Analyst,cibirix digital media,,few days ago,2024-02-19,"advanced analytics  ,  visualization  ,  data analytics  ,  bi  ,  dashboards  ,  data analyst  ,  sql  ,  tableau  ,  data visualization",2 - 5 yrs,Data Analyst 2  yearsABOUT US: Cibirix is a leading digital marketing agency committed to driving results for our clients through innovative and data-driven strategies. Our te...,https://www.timesjobs.com/job-detail/data-analyst-cibirix-digital-media-2-to-5-yrs-jobid-gHpu48XKd2hzpSvf__PLUS__uAgZw==&source=srp
Data Analyst,netskope software pvt.ltd,Bengaluru / Bangalore,2 days ago,2024-02-19,"data analysis  ,   customer management  ,   looker  ,   sql  ,   communication   ,  communication skills  ,  employee recognition",4 - 7 yrs,"About NetskopeToday ,  there's more data and users outside the enterprise than inside ,  causing the network perimeter as we know it to dissolve. We realized a new perimeter w...",https://www.timesjobs.com/job-detail/data-analyst-netskope-software-pvt-ltd-bengaluru-bangalore-4-to-7-yrs-jobid-o10dyX35u0ZzpSvf__PLUS__uAgZw==&source=srp
Data Analyst,netskope software pvt.ltd,Bengaluru / Bangalore,2 days ago,2024-02-19,"data analysis  ,   insights  ,   looker  ,   sql  ,   communication   ,  communication skills  ,  employee recognition",4 - 7 yrs,"About NetskopeToday ,  there's more data and users outside the enterprise than inside ,  causing the network perimeter as we know it to dissolve. We realized a new perimeter w...",https://www.timesjobs.com/job-detail/data-analyst-netskope-software-pvt-ltd-bengaluru-bangalore-4-to-7-yrs-jobid-irTYNqazOoRzpSvf__PLUS__uAgZw==&source=srp
Data Analyst,myglamm popxo,Delhi/NCR,few days ago,2024-02-19,"data analysis   ,   excel   ,   sql   ,   python   ,   communication skills   ,  bi  ,  dashboards  ,  data visualization  ,  tableau  ,  analyst",2 - 4 yrs,"Good Glamm Group in news:The Good Glamm Group ,  a South Asian content-to-commerce conglomerate ,  hasraised $150 million in funding in its Series D round ,  including both pr...",https://www.timesjobs.com/job-detail/data-analyst-myglamm-popxo-delhi-ncr-2-to-4-yrs-jobid-6pvL3yYCARNzpSvf__PLUS__uAgZw==&source=srp
Data Analyst,Travel Centric Technology,Bengaluru / Bangalore,2 days ago,2024-02-19,"information technology  ,  team player  ,  sql",2 - 5 yrs,Qualifications: Bachelor or Master degree in Science o ... r Information Technology or Engineering domain from an accredited college or University.Job Responsibilities: 2 year...,https://www.timesjobs.com/job-detail/data-analyst-travel-centric-technology-bengaluru-bangalore-2-to-5-yrs-jobid-CvE6i__SLASH__GBMh5zpSvf__PLUS__uAgZw==&source=srp
Data Analyst,Hexanika,Pune,4 days ago,2024-02-19,"test data  ,  sql queries  ,  testing  ,  sql",0 - 3 yrs,"Job Description: We are looking to hire a Data Analyst to join our data team. Your responsibility would include for developing reports ,  and troubleshooting data issues. To d...",https://www.timesjobs.com/job-detail/data-analyst-hexanika-pune-0-to-3-yrs-jobid-uV1krqn6UrlzpSvf__PLUS__uAgZw==&source=srp
data analyst.,Randstad MENA,Chennai,5 days ago,2024-02-19,"data extraction   ,   data analysis   ,   data filtering   ,   business intelligence   ,   programming   ,  reports  ,  bi  ,  sql  ,  coding  ,  technical requirements",6 - 9 yrs,"Job DetailsSummaryChennai ,  Tamil NaduA client of Randstad IndiaPermanentReference NumberJPC - 93894Job DetailsJD:Key AccountabilitiesResponsibilities will include but will n...",https://www.timesjobs.com/job-detail/data-analyst-randstad-mena-chennai-6-to-9-yrs-jobid-3jGleB3sAadzpSvf__PLUS__uAgZw==&source=srp
Data Analyst,targray india pvt ltd,Gurgaon,6 days ago,2024-02-19,"data analysis   ,   ms sql   ,   python   ,   etl   ,   business analytics   ,  algorithms  ,  data mining  ,  bi  ,  storage  ,  xml  ,  mysql  ,  data structures  ,  computer application  ,  triggers  ,  written communication",3 - 6 yrs,"Company OverviewTargray - Building sustainable solutions for a world in transition.established in 1987 in Montreal ,  Canada ,  Targray is a global leader in the sourcing ,  t...",https://www.timesjobs.com/job-detail/data-analyst-targray-india-pvt-ltd-gurgaon-3-to-6-yrs-jobid-Pfmyl7DegG1zpSvf__PLUS__uAgZw==&source=srp
DATA ANALYST,mobileforce,Indonesia,5 days ago,2024-02-19,"website  ,  campaigns  ,  google analytics  ,  social media",0 - 3 yrs,"Data is our blood in MobileForce. We use various of digital data to find insights before ,  ongoing ,  and after we develop the digital platform. We need data geeks who are ab...",https://www.timesjobs.com/job-detail/data-analyst-mobileforce-indonesia-0-to-3-yrs-jobid-ui__PLUS__OIaW1O0VzpSvf__PLUS__uAgZw==&source=srp
Data Analyst,netskope software pvt.ltd,Bengaluru / Bangalore,few days ago,2024-02-19,"data analysis  ,   customer satisfaction  ,   analytical development  ,   looker  ,   sql.   ,  communication  ,  communication skills  ,  employee recognition",4 - 7 yrs,"About Netskope Today ,  there's more data and users outside the enterprise than inside ,  causing the network perimeter as we know it to dissolve. We realized a new perimeter ...",https://www.timesjobs.com/job-detail/data-analyst-netskope-software-pvt-ltd-bengaluru-bangalore-4-to-7-yrs-jobid-EfRUb3g5fIZzpSvf__PLUS__uAgZw==&source=srp
Data Analyst,HyreFox Consultants,Jaipur,few days ago,2024-02-19,"excel  ,  reports  ,  reporting  ,  monthly reports",0 - 3 yrs,Must Have - Advance Excel Expertise Create business reports and process all data extracts and imports; ensuring accuracy and attention to detail at all times Collate and produ...,https://www.timesjobs.com/job-detail/data-analyst-hyrefox-consultants-jaipur-0-to-3-yrs-jobid-KwT1r6nTXxFzpSvf__PLUS__uAgZw==&source=srp
Data Analyst,YuktaMedia LLP,Pune,few days ago,2024-02-19,"Information Systems  ,   Computer Science  ,   Computer Engineering  ,  Software Engineering",0 - 2 yrs,"Data AnalystJob ResponsibilitiesHands-on experience working on stored procedures ,  functions ,  cursors ,  etc.Hands-on experience working on creating indexes ,  triggers ,  ...",https://www.timesjobs.com/job-detail/data-analyst-yuktamedia-llp-pune-0-to-2-yrs-jobid-PZwH4yGnIwBzpSvf__PLUS__uAgZw==&source=srp
Data Analyst,SBM OFFSHORE,Bengaluru / Bangalore,few days ago,2024-02-19,"data analysis  ,   analytics  ,   python  ,   power bi  ,   visualization   ,  hive  ,  data extraction  ,  api  ,  oracle  ,  sas  ,  microsoft azure",3 - 5 yrs,"Data AnalystReq Id: 13333Job Family: Reporting  &  SupportLocation: Bangalore ,  IN ,  560071Our Vision.SBM Offshore believes the oceans will provide the world with safe ,  su...",https://www.timesjobs.com/job-detail/data-analyst-sbm-offshore-bengaluru-bangalore-3-to-5-yrs-jobid-XQmdvuNHkMJzpSvf__PLUS__uAgZw==&source=srp
Data Analyst,ANZ GRINDLAYS BANK,Bengaluru / Bangalore,few days ago,2024-02-19,"data analysis   ,   reporting   ,   analytics   ,   stakeholder management   ,   hr data    ,  job posting  ,  recruitment process  ,  workforce  ,  communication skills",5 - 8 yrs,Data AnalystData AnalystReq ID: 57990Department: TT & C People AnalyticsDivision: Talent  &  CultureLocation: BengaluruAbout the roleAt ANZ our purpose is to shape a world whe...,https://www.timesjobs.com/job-detail/data-analyst-anz-grindlays-bank-bengaluru-bangalore-5-to-8-yrs-jobid-UIG__SLASH__UiBb71BzpSvf__PLUS__uAgZw==&source=srp
Data Analysts,kudosindia,Mumbai,few days ago,2024-02-19,"test cases  ,  database  ,  metrics  ,  component testing",0 - 3 yrs,Data AnalystsJob descriptionInterpret and analyze data to identify patterns and correlations among the various data points.mapping and tracing data from system to system in or...,https://www.timesjobs.com/job-detail/data-analysts-kudosindia-mumbai-0-to-3-yrs-jobid-v48SsInbeSRzpSvf__PLUS__uAgZw==&source=srp
Data Analyst,Ipseity Group,Bhopal,few days ago,2024-02-19,"reports  ,  vb  ,  data collection  ,  xml  ,  procedures",1 - 3 yrs,Position Data Analyst Role Coordinate with customers and staff and provide support to all data analysis.Perform data analysis process on all hard copy data as well as softcopy...,https://www.timesjobs.com/job-detail/data-analyst-ipseity-group-bhopal-1-to-3-yrs-jobid-ADc3ie9lzZBzpSvf__PLUS__uAgZw==&source=srp
Data Analyst,alliance recruitment agency,Anand,few days ago,2024-02-19,"python  ,  sql  ,   Python Strong",8 - 10 yrs,"Responsibilities:An accomplished data analyst with hands-on experience in the BFSI domain ,  preferably with prior experience in techno-functional roles with building and mana...",https://www.timesjobs.com/job-detail/data-analyst-alliance-recruitment-agency-anand-8-to-10-yrs-jobid-Vu0zuigTsTlzpSvf__PLUS__uAgZw==&source=srp
Data Analyst,alliance recruitment agency,Ahmedabad,few days ago,2024-02-19,"python  ,  problem solving  ,  sql",8 - 10 yrs,"An accomplished data analyst with hands-on experience in BFSI domain ,  preferably with prior experience in techno functional role with building and managing ML models ,  data...",https://www.timesjobs.com/job-detail/data-analyst-alliance-recruitment-agency-ahmedabad-8-to-10-yrs-jobid-VdCPOPjDsSZzpSvf__PLUS__uAgZw==&source=srp
Data Analyst,ivy tech solutions,,few days ago,2024-02-19,"data quality  ,  information technology  ,  etl  ,  data integration",0 - 3 yrs,"Job Duties: Develop strategies to understand and optimize the business processes ,  requirements of the client / management. Implement automated ETL processes for high perform...",https://www.timesjobs.com/job-detail/data-analyst-ivy-tech-solutions-0-to-3-yrs-jobid-GTWuhWzZHmpzpSvf__PLUS__uAgZw==&source=srp
Data Analyst,vixplor analytics pvt ltd,Kolkata,few days ago,2024-02-19,"Marketing Ability  ,   Leadership Qualities  ,   Communication Skill  ,   Achieving Sales Target  ,   Fluent in Hindi   ,  marketing  ,  sales",0 - 5 yrs,"Location: Kolkata Description: Responsible for marketing and sales. Working with Vixplor ,  you will get exposure to wide range in marketing. There will be good number of oppo...",https://www.timesjobs.com/job-detail/data-analyst-vixplor-analytics-pvt-ltd-kolkata-0-to-5-yrs-jobid-CksdzzcZwZZzpSvf__PLUS__uAgZw==&source=srp
Data Analyst,advanced risk analytics private limited,Pune,few days ago,2024-02-19,"visualizing data  ,  data collection  ,  Flood data",0 - 3 yrs,"Candidate should have:Knowledge of catastrophe data collection like Flood data ,  Earthquake data ,  Image processing data from satellite ,  LIDAR and DroneSynthesizing and vi...",https://www.timesjobs.com/job-detail/data-analyst-advanced-risk-analytics-private-limited-pune-0-to-3-yrs-jobid-TmPblskT8fVzpSvf__PLUS__uAgZw==&source=srp
Data Analyst,"HAPPY SQUARE OUTSOURCING SERVICES PVT.LTD.
     (More Jobs)",(More Jobs),few days ago,2024-02-19,"SQL  ,  XML  ,  Javascript  ,  Excel",1 - 2 yrs,Data Analyst Job DutiesData analyst responsibilities include conducting full lifecycle analysis to includerequirements  activities and design. Data analysts will develop analy...,https://www.timesjobs.com/job-detail/data-analyst-white-force-outsourcing-pvt-ltd-mumbai-1-to-2-yrs-jobid-pEshBzWAMdVzpSvf__PLUS__uAgZw==&source=srp
"Data Analyst , Senior Data Analyst","Phoenix Global Resettlement Services Pvt Ltd
     (More Jobs)",(More Jobs),few days ago,2024-02-19,"Data Analyst  ,  analyst  ,  senior analyst  ,  system analyst",3 - 7 yrs,"Dear Candidate , We find your profile is suitable for vacancies available at our clients locations in Canada.canada is currently facing a shortage of Qualified and experienced...",https://www.timesjobs.com/job-detail/data-analyst-senior-data-analyst-phoenix-global-resettlement-services-pvt-ltd-bengaluru-bangalore-3-to-7-yrs-jobid-hHvBS5jXAgNzpSvf__PLUS__uAgZw==&source=srp
Data Analyst,"HR Empower Consultancy
     (More Jobs)",(More Jobs),Work from Home,2024-02-19,"databases  ,  SQL  ,  XML  ,  ETL frameworks  ,  Excel  ,  SPSS  ,  SAS  ,  analytical skills  ,  Javascript",0 - 1 yrs,"Data Analyst jobdescription Interpret data ,  analyze results using statistical techniques and provide ongoing reportsDevelop andimplement databases ,  data collection systems...",https://www.timesjobs.com/job-detail/data-analyst-hr-empower-consultancy-yamunanagar-shimla-gwalior-chandigarh-jaipur-0-to-1-yrs-jobid-RB4OZC__PLUS__W6LVzpSvf__PLUS__uAgZw==&source=srp
Data Analyst and Tableau Developer,gantec publishing solutions pvt. ltd.,,few days ago,2024-02-19,"sas  ,  information technology  ,  bi  ,  data analyst  ,  sql  ,  tableau  ,  tableau developer",0 - 3 yrs,Description :Develops and maintains a standard methodology for documenting and codifying requirements and specifications using standard templates that meet the needs of both b...,https://www.timesjobs.com/job-detail/data-analyst-and-tableau-developer-gantec-publishing-solutions-pvt-ltd-0-to-3-yrs-jobid-2kuA7KvYhnBzpSvf__PLUS__uAgZw==&source=srp
Data Analyst  ( Python ),alliance recruitment agency,Switzerland,few days ago,2024-02-19,"data analysis  ,  data analyst  ,  vba  ,  business consulting  ,  analyst",2 - 8 yrs,ResponsibilitiesBeing able to quickly understand the business questions and project context for new projects. We do business consulting this is then important to understand wh...,https://www.timesjobs.com/job-detail/data-analyst-python-alliance-recruitment-agency-switzerland-2-to-8-yrs-jobid-EuV7B2l__PLUS__jN9zpSvf__PLUS__uAgZw==&source=srp
Data Analyst  Power BI,IRT Computer Solutions  ( I )  Pvt Ltd,"Hyderabad/Secunderabad,  Chennai",few days ago,2024-02-19,"tableau  ,  qlik sense  ,  bi  ,  report builder  ,  data analyst",4 - 7 yrs,Min 4  years of experienceJob Description Strong knowledge of data modeling principles and dashboarding with Power BI.mastery of DAX programming.Familiarity with Power Automat...,https://www.timesjobs.com/job-detail/data-analyst-power-bi-irt-computer-solutions-i-pvt-ltd-hyderabad-secunderabad-chennai-4-to-7-yrs-jobid-YNMP9rCUQstzpSvf__PLUS__uAgZw==&source=srp
Senior Data Analyst - 170554,HyreFox Consultants,Bengaluru / Bangalore,few days ago,2024-02-19,"data analysis   ,   solution design   ,   business stakeholder engagement   ,   data visualization   ,   database querying   ,  user stories  ,  data analyst  ,  tableau",0 - 3 yrs,"Description:An exciting opportunity within the CDO  Data Solutions team to play a key role in all data solution design activities on behalf of the Chief Data Office ,  working...",https://www.timesjobs.com/job-detail/senior-data-analyst-170554-hyrefox-consultants-bengaluru-bangalore-0-to-3-yrs-jobid-frrYZrghHLBzpSvf__PLUS__uAgZw==&source=srp
Research - Senior Data Analyst,Information Services Group,Bengaluru / Bangalore,few days ago,2024-02-19,"data analysis  ,   research  ,   excel skills  ,   data manipulation  ,   secondary research   ,  bi  ,  dashboards  ,  database  ,  advanced excel  ,  data visualization  ,  consulting  ,  data analyst  ,  infrastructure",4 - 7 yrs,"Research - Senior Data Analyst Research-Provider Lens Bangalore ,  IndiaApplyDescriptionWanted: dynamic and creative individuals ready to connect with a like-minded team. Youl...",https://www.timesjobs.com/job-detail/research-senior-data-analyst-information-services-group-bengaluru-bangalore-4-to-7-yrs-jobid-aJWaj6olEHJzpSvf__PLUS__uAgZw==&source=srp
Sr. Data Analyst || Dehradun,ebizon net info  ( p )  ltd,Dehradun,few days ago,2024-02-19,"data analytics   ,   data mining   ,   data visualization   ,   business analytics   ,   sql skills   ,  spss  ,  database  ,  xml  ,  sas  ,  consulting  ,  data analyst  ,  tableau  ,  statistical analysis",3 - 6 yrs,"We are looking for an experienced data analyst to join our team in Dehradun. The ideal candidate will be highly skilled in all aspects of data analytics ,  including mining , ...",https://www.timesjobs.com/job-detail/sr-data-analyst-dehradun-ebizon-net-info-p-ltd-dehradun-3-to-6-yrs-jobid-0gySldxZUhBzpSvf__PLUS__uAgZw==&source=srp
Senior Data Analyst,CTE,,few days ago,2024-02-19,"visualization  ,  information technology  ,  data mining  ,  sql  ,  java  ,  business process improvement  ,  data analytics  ,  data analysis  ,  consulting  ,  business analysis  ,  mining  ,  data analyst  ,  business intelligence reporting  ,  tableau  ,  predictive modeling",7 - 12 yrs,"Data analyst who can turn data into information ,  information into insight ,  and insight into business decisions. He or she should be highly skilled in all aspects of data a...",https://www.timesjobs.com/job-detail/senior-data-analyst-cte-7-to-12-yrs-jobid-mHffd3opMf9zpSvf__PLUS__uAgZw==&source=srp
Lead Data Analyst,Clarivate Analytics,Bengaluru / Bangalore,6 days ago,2024-02-19,"data analysis   ,   business intelligence   ,   sql   ,   python   ,   data warehousing   ,  visualization  ,  information technology  ,  bi  ,  security  ,  technology consulting  ,  data analytics  ,  director  ,  data analyst  ,  tableau  ,  data governance",5 - 7 yrs,"Job Number: JREQ125321City ,  ST: Bangalore ,  KADate Posted: 11 / 8 / 2023Fraud Warning: Please be advised that recently there have been fraudulent job offers and interviews ...",https://www.timesjobs.com/job-detail/lead-data-analyst-clarivate-analytics-bengaluru-bangalore-5-to-7-yrs-jobid-ih8LfmOUI3pzpSvf__PLUS__uAgZw==&source=srp
Senior Data Analyst,Electronic Arts Games  ( India )  Pvt. Ltd.,Hyderabad/Secunderabad,few days ago,2024-02-19,"business intelligence  ,   data analysis  ,   risk management  ,   data extraction  ,   visualization tools   ,  bi  ,  dashboards  ,  sql  ,  data science  ,  advanced analytics  ,  director  ,  predictive analytics  ,  data analyst  ,  alteryx  ,  tableau",3 - 6 yrs,"Senior Data Analyst Location: Hyderabad ,  Telangana ,  India ApplyRequisition Number: 181868Can this position be remote?: NoWe are a global team of creators ,  storytellers ,...",https://www.timesjobs.com/job-detail/senior-data-analyst-electronic-arts-games-india-pvt-ltd-hyderabad-secunderabad-3-to-6-yrs-jobid-lLu__SLASH____SLASH__xb0KchzpSvf__PLUS__uAgZw==&source=srp
Sr. Data Analyst - Noida,ebizon net info  ( p )  ltd,Noida/Greater Noida,few days ago,2024-02-19,"data analytics   ,   data mining   ,   data visualization   ,   powerbi  /   tableau   ,   sql  /   excel   ,  spss  ,  database  ,  xml  ,  sas  ,  consulting  ,  business analytics  ,  data analyst  ,  statistical analysis",3 - 6 yrs,"We are looking for an experienced data analyst to join our team in Noida. The ideal candidate will be highly skilled in all aspects of data analytics ,  including mining ,  ge...",https://www.timesjobs.com/job-detail/sr-data-analyst-noida-ebizon-net-info-p-ltd-noida-greater-noida-3-to-6-yrs-jobid-__SLASH__pAoPrNFT4hzpSvf__PLUS__uAgZw==&source=srp
Senior Data Analyst,Sigmoid,Bengaluru / Bangalore,few days ago,2024-02-19,"data analytics   ,   data visualization   ,   business intelligence   ,   statistical  /  ml techniques   ,   team management   ,  san  ,  advanced analytics  ,  spotfire  ,  bi  ,  data analyst  ,  tableau  ,  data science  ,  client interaction  ,  sql database",3 - 6 yrs,"Sigmoid Analytics is a leading Data solutions company backed by Sequoia Capital. We oer best in- end-to-end data value chain spanning across Data Science ,  Data Engineering a...",https://www.timesjobs.com/job-detail/senior-data-analyst-sigmoid-bengaluru-bangalore-3-to-6-yrs-jobid-HNofGelG6xpzpSvf__PLUS__uAgZw==&source=srp
Jr. Data Analyst,HUDSONS BAY SERVICES PRIVATE LIMITED,Other City(s) in Karnataka,few days ago,2024-02-19,"data analysis   ,   project management   ,   business intelligence   ,   sql   ,   python   ,  visualization  ,  data mining  ,  dashboards  ,  data extraction  ,  advanced analytics  ,  data analytics  ,  business analytics  ,  data analyst  ,  retail analytics",2 - 5 yrs,"Job Details Jr. Data Analyst Location: BANGALORE ,  KARNATAKA Date Opened: 11 / 16 / 2023Job Type: Job Number: 230004GPJob Description Day in the Life:The Data Analyst will be...",https://www.timesjobs.com/job-detail/jr-data-analyst-hudsons-bay-services-private-limited-other-city-s-in-karnataka-2-to-5-yrs-jobid-So1aGzVKFoBzpSvf__PLUS__uAgZw==&source=srp
Data Analyst  /  Business Analyst,SLA Consultants India,"Noida/Greater Noida,  Gurgaon,  Delhi,  Delhi/NCR",5 days ago,2024-02-19,"process analyst  ,  dashboards  ,  ms access  ,  vba  ,  bi  ,  business analyst  ,  sql  ,  advanced excel  ,  data",3 - 5 yrs,and Advanced Excel is preferredFamiliarity with RDBMS is expected. Understanding of MySQL query is an added advantage.Ability to multi task and good time management skills is ...,https://www.timesjobs.com/job-detail/data-analyst-business-analyst-sla-consultants-india-noida-greater-noida-gurgaon-delhi-delhi-ncr-3-to-5-yrs-jobid-tnz3VmbO75dzpSvf__PLUS__uAgZw==&source=srp
Associate Data Analyst,Clarivate Analytics,Bengaluru / Bangalore,3 days ago,2024-02-19,"data analysis   ,   research   ,   data mining   ,   sql   ,   advanced excel   ,  compensation",1 - 4 yrs,"Job Number: JREQ125061City ,  ST: Bangalore ,  KADate Posted: 10 / 25 / 2023Fraud Warning: Please be advised that recently there have been fraudulent job offers and interviews...",https://www.timesjobs.com/job-detail/associate-data-analyst-clarivate-analytics-bengaluru-bangalore-1-to-4-yrs-jobid-__SLASH__9hbk0__SLASH__G7q1zpSvf__PLUS__uAgZw==&source=srp
MIS executive - Data Analyst,NIPPON DATA SYSTEM,"Delhi,  Delhi/NCR",3 days ago,2024-02-19,"oracle  ,  bi  ,  siebel  ,  sql  ,  oracle erp  ,  mvc  ,  crm",3 - 5 yrs,Job Description : Responsible for creating and generating Service Order reports required for Keysight internally using Business Intelligence reporting tools and able to provid...,https://www.timesjobs.com/job-detail/mis-executive-data-analyst-nippon-data-system-delhi-delhi-ncr-3-to-5-yrs-jobid-Hbp8BAo__SLASH__VDBzpSvf__PLUS__uAgZw==&source=srp
Data Analyst at Toolyt,toolyt,Jaipur,few days ago,2024-02-19,"data analysis   ,   statistical techniques   ,   database management   ,   data collection systems   ,   sql database design   ,  maths  ,  science  ,  statistics",1 - 5 yrs,"Data Analyst at Toolyt LocationJaipur ,  IndiaSalary35000 - 45000  / monthJob TypeFull-timeDate PostedDecember 13th ,  2023Apply NowWe are looking for a passionate certified D...",https://www.timesjobs.com/job-detail/data-analyst-at-toolyt-toolyt-jaipur-1-to-5-yrs-jobid-npBDOtTsQJpzpSvf__PLUS__uAgZw==&source=srp
